{
  "schemaVersion": "1.0",
  "id": "project-local-template",
  "kind": "component",
  "scope": "project-local-template",
  "facts": [
    {
      "id": "plt.layout",
      "classification": "FACT",
      "summary": "project-local-template contains AGENTS.md, .commandcode/, .docgen/, docs/, and scripts/.",
      "source": { "path": "project-local-template" }
    },
    {
      "id": "plt.commandcode",
      "classification": "FACT",
      "summary": ".commandcode/ contains settings.json plus agents/, commands/, hooks/, skills/ directories.",
      "source": { "path": "project-local-template/.commandcode" }
    },
    {
      "id": "plt.scripts",
      "classification": "FACT",
      "summary": "scripts/ contains docgen.mjs, docgen.ps1, docgen.sh.",
      "source": { "path": "project-local-template/scripts" }
    },
    {
      "id": "plt.copyLogic",
      "classification": "FACT",
      "summary": "install.mjs installProjectLocal copies the template tree into the target (skipping AGENTS.md and .commandcode/settings.json from the tree copy), appends AGENTS.md between COMMANDCODE-DOCGEN markers, and merges hooks into the target .commandcode/settings.json.",
      "source": { "path": "install.mjs", "symbol": "installProjectLocal" }
    },
    {
      "id": "plt.scriptsDelegate",
      "classification": "INFERENCE",
      "summary": "scripts/docgen.* likely delegate to the engine (mirroring the install wrapper pattern); bodies were not read.",
      "source": { "path": "project-local-template/scripts" }
    },
    {
      "id": "plt.overrideContent",
      "classification": "UNKNOWN",
      "summary": "Full content of the .commandcode overrides (agents/, commands/, hooks/, skills/, settings.json) was not read.",
      "source": { "path": "project-local-template/.commandcode" }
    }
  ]
}
