{
  "schemaVersion": "1.0",
  "id": "agents",
  "kind": "component",
  "scope": "global-template/agents",
  "facts": [
    {
      "id": "agents.files",
      "classification": "FACT",
      "summary": "Five custom agents: doc-discoverer.md, doc-architect.md, doc-planner.md, doc-writer.md, doc-auditor.md.",
      "source": { "path": "global-template/agents" }
    },
    {
      "id": "agents.roles",
      "classification": "FACT",
      "summary": "Roles per README: doc-discoverer (source->evidence), doc-architect (evidence->model), doc-planner (model->plan/manifest), doc-writer (one bounded page per run), doc-auditor (claims->evidence verification).",
      "source": { "path": "README.md", "symbol": "Agents" }
    },
    {
      "id": "agents.bodies",
      "classification": "UNKNOWN",
      "summary": "Detailed agent prompt bodies were not read; only filenames and README role summaries are confirmed.",
      "source": { "path": "global-template/agents" }
    }
  ]
}
