{
  "schemaVersion": "1.0",
  "id": "engine-hooks",
  "kind": "component",
  "scope": "global-template/docgen/hooks",
  "facts": [
    {
      "id": "hooks.files",
      "classification": "FACT",
      "summary": "Five hook scripts exist: docgen-common.mjs, docgen-guard-shell.mjs, docgen-guard-write-paths.mjs, docgen-session-context.mjs, docgen-validate-written-artifact.mjs.",
      "source": { "path": "global-template/docgen/hooks" }
    },
    {
      "id": "hooks.wiring",
      "classification": "INFERENCE",
      "summary": "Hooks are wired to Command Code events via install.mjs mergeGlobalSettings: SessionStart=session-context; PreToolUse write|edit=guard-write-paths; PreToolUse shell=guard-shell; PostToolUse write|edit=validate-written-artifact.",
      "source": { "path": "install.mjs", "symbol": "mergeGlobalSettings" },
      "evidenceIds": ["dist.hooksMerge"]
    },
    {
      "id": "hooks.logic",
      "classification": "UNKNOWN",
      "summary": "Exact enforcement logic inside each hook file was not read; README describes a write allowlist (docs/**, .docgen/**) and read-only shell guard, but the implementation is unverified here.",
      "source": { "path": "global-template/docgen/hooks" }
    }
  ]
}
